{
  "schema_version": 1,
  "asset": "pearl-mainnet-native-prl",
  "token_quote": "USDT",
  "fx_base": "USDT",
  "fx_quote": "USD",
  "enabled": false,
  "fx_enabled": false,
  "prl_usdt": "",
  "prl_as_of_utc": 0,
  "usdt_usd": "",
  "fx_as_of_utc": 0,
  "confirmed_utc": 0,
  "validity_seconds": 3600,
  "max_fx_skew_seconds": 30
}
